{
  "schemaVersion": 2,
  "meta": {
    "version": "1.0.0",
    "encoding": "hex",
    "note": "Cross-language fixtures consumed by both Java and TypeScript parity tests. Only entries with an external source are standards-conformance evidence; project fixtures verify protocol and encoding parity. SM2 entries validate by decrypt/verify, not ciphertext literal."
  },
  "defaults": {
    "sm4KeyHex": "0123456789abcdeffedcba9876543210",
    "sm4IvHex": "000102030405060708090a0b0c0d0e0f",
    "zucKeyHex": "00112233445566778899aabbccddeeff",
    "zucIvHex": "ffeeddccbbaa99887766554433221100",
    "sm2PublicKeyHex": "045647ebf2adcaf54f8102bea9a7ca8905794a3f2f29622593269bb55d72e0a140dc81f3dce73bb609f8a056640db0e04c08e0bd8be79140702bbdb0206e95b7ac",
    "sm2PrivateKeyHex": "228049e009de869baf9aba74f8f8c52e09cde1b52cafb0df7ab154ba4593743e"
  },
  "cases": [
    {
      "id": "sm3-hello",
      "sourceId": "sm3-hello",
      "sourceType": "project-fixture",
      "sourceRef": "vectors/interop.json",
      "description": "用于 Java 与 TypeScript 摘要结果对齐的项目固定输入。",
      "algo": "SM3",
      "op": "digest",
      "input": "Hello GMKit",
      "expected": {
        "hex": "c90b8d11a6f41032c0412df97267a772f987ab4b4a0bcad9a4025f0be27bbe2c"
      }
    },
    {
      "id": "sm3-zh",
      "sourceId": "sm3-zh",
      "sourceType": "project-fixture",
      "sourceRef": "vectors/interop.json",
      "description": "用于 UTF-8 中文输入对齐的项目固定输入。",
      "algo": "SM3",
      "op": "digest",
      "input": "坏事到我为止，好事从此开始",
      "expected": {
        "hex": "a05f4738cc49c81a8feb03c9b5e9fe44845e48871af79e0e7c4fdd378f80e071"
      }
    },
    {
      "id": "sm3-emoji",
      "sourceId": "sm3-emoji",
      "sourceType": "project-fixture",
      "sourceRef": "vectors/interop.json",
      "description": "用于 UTF-8 非 BMP 字符对齐的项目固定输入。",
      "algo": "SM3",
      "op": "digest",
      "input": "可爱的小熊 🧸",
      "expected": {
        "hex": "b703ad6573c7271325a23624f28562fd9609bdadb7d66dffaa69dbb32ea140b8"
      }
    },
    {
      "id": "sm3-aligned-ascii",
      "sourceId": "sm3-aligned-ascii",
      "sourceType": "project-fixture",
      "sourceRef": "vectors/interop.json",
      "description": "用于 ASCII 输入回归的项目固定输入。",
      "algo": "SM3",
      "op": "digest",
      "input": "hello gmkit",
      "expected": {
        "hex": "3425c540fb7b120f9c585786c53fba004f151ff207edcd58f1cfff18857e034a"
      }
    },
    {
      "id": "sm3-aligned-chinese",
      "sourceId": "sm3-aligned-chinese",
      "sourceType": "project-fixture",
      "sourceRef": "vectors/interop.json",
      "description": "用于中文输入回归的项目固定输入。",
      "algo": "SM3",
      "op": "digest",
      "input": "你好，国密",
      "expected": {
        "hex": "d5a98f677223c159be053eb1eb74886daa87455fdbcdd1b34551caa83f0332d1"
      }
    },
    {
      "id": "sm3-aligned-emoji",
      "sourceId": "sm3-aligned-emoji",
      "sourceType": "project-fixture",
      "sourceRef": "vectors/interop.json",
      "description": "用于 Emoji 输入回归的项目固定输入。",
      "algo": "SM3",
      "op": "digest",
      "input": "国密测试 😊🚀🔥",
      "expected": {
        "hex": "25007eb85ec568fdc5f8acd881c1520b9e5ca48871d432ec61226fd5f42cfed5"
      }
    },
    {
      "id": "sm3-aligned-mixed-unicode",
      "sourceId": "sm3-aligned-mixed-unicode",
      "sourceType": "project-fixture",
      "sourceRef": "vectors/interop.json",
      "description": "用于混合 Unicode 输入回归的项目固定输入。",
      "algo": "SM3",
      "op": "digest",
      "input": "中文 + emoji 😊 + English + 123",
      "expected": {
        "hex": "2c0fba270ed6a572d05d21a138009376e479825d746d361bcd4a583adfa8145d"
      }
    },
    {
      "id": "sm3-aligned-newlines-tabs",
      "sourceId": "sm3-aligned-newlines-tabs",
      "sourceType": "project-fixture",
      "sourceRef": "vectors/interop.json",
      "description": "用于换行和制表符输入回归的项目固定输入。",
      "algo": "SM3",
      "op": "digest",
      "input": "第一行\nsecond line\t第三行",
      "expected": {
        "hex": "75e37ae3b6bc3f60887d09f365d7380a5c034b83233fd65ef89cb5cd78584ec1"
      }
    },
    {
      "id": "sm3-aligned-spaces",
      "sourceId": "sm3-aligned-spaces",
      "sourceType": "project-fixture",
      "sourceRef": "vectors/interop.json",
      "description": "用于前后空格输入回归的项目固定输入。",
      "algo": "SM3",
      "op": "digest",
      "input": "  前后空格\tspaces  ",
      "expected": {
        "hex": "0e1bf25b76bd2ba2a006cb30f7fbd6eb237beca41956b3dd465b05740def94ea"
      }
    },
    {
      "id": "sm3-aligned-symbols",
      "sourceId": "sm3-aligned-symbols",
      "sourceType": "project-fixture",
      "sourceRef": "vectors/interop.json",
      "description": "用于标点和特殊字符输入回归的项目固定输入。",
      "algo": "SM3",
      "op": "digest",
      "input": "SM2/SM3/SM4/ZUC: !@#$%^&*()_+-=[]{}|;:,.<>?",
      "expected": {
        "hex": "26967d98e958ba5e7a957706ebdffcb0fd104343689129dcf524ba5fd683d59b"
      }
    },
    {
      "id": "sm4-ecb-hello",
      "sourceId": "sm4-ecb-hello",
      "sourceType": "project-fixture",
      "sourceRef": "vectors/interop.json",
      "description": "用于 SM4 ECB 编码对齐的项目固定输入。",
      "algo": "SM4",
      "op": "encrypt",
      "mode": "ECB",
      "padding": "PKCS7",
      "keyHex": "0123456789abcdeffedcba9876543210",
      "input": "Hello GMKit",
      "expected": {
        "cipherHex": "aeb1def8fec181b3d0ab347d7d04e2bb"
      }
    },
    {
      "id": "sm4-ecb-zh",
      "sourceId": "sm4-ecb-zh",
      "sourceType": "project-fixture",
      "sourceRef": "vectors/interop.json",
      "description": "用于 SM4 ECB 中文输入对齐的项目固定输入。",
      "algo": "SM4",
      "op": "encrypt",
      "mode": "ECB",
      "padding": "PKCS7",
      "keyHex": "0123456789abcdeffedcba9876543210",
      "input": "坏事到我为止，好事从此开始",
      "expected": {
        "cipherHex": "1ac3db7282c7a0c34feec8d2e5f120f1a90ac320650f93658f0b282e8ec2ef77778abc9a43c676731007aa791de7c296"
      }
    },
    {
      "id": "sm4-ecb-emoji",
      "sourceId": "sm4-ecb-emoji",
      "sourceType": "project-fixture",
      "sourceRef": "vectors/interop.json",
      "description": "用于 SM4 ECB 非 BMP 输入对齐的项目固定输入。",
      "algo": "SM4",
      "op": "encrypt",
      "mode": "ECB",
      "padding": "PKCS7",
      "keyHex": "0123456789abcdeffedcba9876543210",
      "input": "可爱的小熊 🧸",
      "expected": {
        "cipherHex": "035adea04123fb14c67a61f056bc6c997998ad78e14e3460da8e35f73dc2c407"
      }
    },
    {
      "id": "sm4-cbc-hello",
      "sourceId": "sm4-cbc-hello",
      "sourceType": "project-fixture",
      "sourceRef": "vectors/interop.json",
      "description": "用于 SM4 CBC 编码对齐的项目固定输入。",
      "algo": "SM4",
      "op": "encrypt",
      "mode": "CBC",
      "padding": "PKCS7",
      "keyHex": "0123456789abcdeffedcba9876543210",
      "ivHex": "000102030405060708090a0b0c0d0e0f",
      "input": "Hello GMKit",
      "expected": {
        "cipherHex": "2389287c90cabd1ab3bf6b89159d6779"
      }
    },
    {
      "id": "sm4-cbc-zh",
      "sourceId": "sm4-cbc-zh",
      "sourceType": "project-fixture",
      "sourceRef": "vectors/interop.json",
      "description": "用于 SM4 CBC 中文输入对齐的项目固定输入。",
      "algo": "SM4",
      "op": "encrypt",
      "mode": "CBC",
      "padding": "PKCS7",
      "keyHex": "0123456789abcdeffedcba9876543210",
      "ivHex": "000102030405060708090a0b0c0d0e0f",
      "input": "坏事到我为止，好事从此开始",
      "expected": {
        "cipherHex": "00f08407706413eae4e93329bb02cd2d7b4dd1ebccfc75d4d5861176b9d44958efaf31326d590eb0901e1a7a7feddd83"
      }
    },
    {
      "id": "sm4-cbc-emoji",
      "sourceId": "sm4-cbc-emoji",
      "sourceType": "project-fixture",
      "sourceRef": "vectors/interop.json",
      "description": "用于 SM4 CBC 非 BMP 输入对齐的项目固定输入。",
      "algo": "SM4",
      "op": "encrypt",
      "mode": "CBC",
      "padding": "PKCS7",
      "keyHex": "0123456789abcdeffedcba9876543210",
      "ivHex": "000102030405060708090a0b0c0d0e0f",
      "input": "可爱的小熊 🧸",
      "expected": {
        "cipherHex": "ffd57580bfbb72304e0ffd6b777fb008b00640a24493e457c9278822b5c8d51c"
      }
    },
    {
      "id": "zuc-keystream-zero",
      "sourceId": "zuc-keystream-zero",
      "sourceType": "project-fixture",
      "sourceRef": "vectors/interop.json",
      "description": "用于 ZUC 零密钥输入回归的项目固定输入。",
      "algo": "ZUC",
      "op": "keystream",
      "keyHex": "00000000000000000000000000000000",
      "ivHex": "00000000000000000000000000000000",
      "lengthBytes": 8,
      "expected": {
        "hex": "27bede74018082da"
      }
    },
    {
      "id": "zuc-keystream-shared",
      "sourceId": "zuc-keystream-shared",
      "sourceType": "project-fixture",
      "sourceRef": "vectors/interop.json",
      "description": "用于 ZUC 密钥流跨语言对齐的项目固定输入。",
      "algo": "ZUC",
      "op": "keystream",
      "keyHex": "00112233445566778899aabbccddeeff",
      "ivHex": "ffeeddccbbaa99887766554433221100",
      "lengthBytes": 32,
      "expected": {
        "hex": "deeb81e388e6bbad1c44b2bbf56776644a80953ad9005380ec8d392fb3a1548b"
      }
    },
    {
      "id": "zuc-encrypt-ascii",
      "sourceId": "zuc-encrypt-ascii",
      "sourceType": "project-fixture",
      "sourceRef": "vectors/interop.json",
      "description": "用于 ZUC ASCII 流加密对齐的项目固定输入。",
      "algo": "ZUC",
      "op": "encrypt",
      "input": "hello gmkit",
      "expected": {
        "cipherHex": "b68eed8fe7c6dcc0772dc6",
        "cipherBase64": "to7tj+fG3MB3LcY="
      }
    },
    {
      "id": "zuc-encrypt-chinese",
      "sourceId": "zuc-encrypt-chinese",
      "sourceType": "project-fixture",
      "sourceRef": "vectors/interop.json",
      "description": "用于 ZUC 中文流加密对齐的项目固定输入。",
      "algo": "ZUC",
      "op": "encrypt",
      "input": "你好，国密",
      "expected": {
        "cipherHex": "3a5621062d5b541190a1290610c8f0"
      }
    },
    {
      "id": "zuc-encrypt-emoji",
      "sourceId": "zuc-encrypt-emoji",
      "sourceType": "project-fixture",
      "sourceRef": "vectors/interop.json",
      "description": "用于 ZUC 非 BMP 流加密对齐的项目固定输入。",
      "algo": "ZUC",
      "op": "encrypt",